date,"hour","text","source","username","hashtags"		
2019-06-25,"0:30:59","Nasa foi hackeada por computador de US$ 35 normalmente usado por crianças https://t.co/VFyyWikkn2","WordPress.com","exame",""		
2019-06-25,"0:20:12","Transpetro firma com TAG contrato de R$ 5 bi para transporte de gás https://t.co/DwyFHnS7G1","WordPress.com","exame",""		
2019-06-25,"0:11:42","STF adia julgamento de extradição de turco exilado no Brasil https://t.co/Qwpfzjlj6C","WordPress.com","exame",""		
2019-06-25,"0:05:36","“Cobrem mais impostos de nós!”, pedem bilionários americanos https://t.co/SChmXN2mVU","WordPress.com","exame",""		
2019-06-24,"23:57:56","Correios foram usados de forma irregular, afirma Bolsonaro https://t.co/zLXzCuyFyn","WordPress.com","exame",""		
2019-06-24,"23:01:28","Prefeitura de Votuporanga afasta funcionárias suspeitas de dopar crianças https://t.co/l4TkdL6c0w","WordPress.com","exame",""		
2019-06-24,"22:47:59","Delatores de acordos homologados no STF já devolveram R$ 1,1 bilhão https://t.co/IxH9CZeXKm","WordPress.com","exame",""		
2019-06-24,"22:45:38","Barroso suspende MP de Bolsonaro que transfere demarcação à Agricultura https://t.co/L2ub5tsehS","WordPress.com","exame","CopaAmerica"		
2019-06-24,"22:34:09","Guedes diz que preço da energia pode cair 40% em 2 anos com plano para gás https://t.co/20M5JUKmFn","WordPress.com","exame",""		
2019-06-24,"22:21:50","Pré-venda de ingressos para “O Rei Leão” começa nesta segunda-feira, 24 https://t.co/inTYRkL7iA","WordPress.com","exame",""		
2019-06-24,"22:08:38","Governo de SP vai leiloar R$ 52 milhões em créditos de ICMS https://t.co/8vsAYK7Dl5","WordPress.com","exame",""		
2019-06-24,"22:07:06","No Twitter, deputados criticam cancelamento da ida de Moro à Câmara https://t.co/duqAzPkgwQ","WordPress.com","exame",""		
2019-06-24,"22:00:31","6 atitudes para causar uma boa impressão no novo emprego https://t.co/drN72XheDW","WordPress.com","exame",""		
2019-06-24,"21:55:40","México envia 15 mil militares à fronteira com EUA para conter imigrantes https://t.co/lp5ehKq5v3","WordPress.com","exame",""		
2019-06-24,"21:52:03","Brasil é potência regional na luta anticorrupção, mas com uma perna manca https://t.co/9cbuCUu81p","WordPress.com","exame",""		
2019-06-24,"21:41:12","Senadores dos EUA querem saber quanto empresas ganham com dados https://t.co/sQb3ub2L7h","WordPress.com","exame","CopaAmerica"		
2019-06-24,"21:38:50","Gol é companhia aérea que mais atrasou voos de janeiro a maio, diz AirHelp https://t.co/OsrQ2MNhEO","WordPress.com","exame",""		
2019-06-24,"21:21:13","Joice diz que Bolsonaro é “simpático” à sua candidatura à Prefeitura de SP https://t.co/lkErkuLTRX","WordPress.com","exame","CopaAmerica"		
2019-06-24,"21:20:06","Bolsonaro diz que há “99% de chance” de F1 voltar para o Rio em 2021 https://t.co/jTdjF5dIfq","WordPress.com","exame",""		
2019-06-24,"21:11:20","Guardiões do dinheiro já desafiam nova moeda digital do Facebook https://t.co/GQutEnp13A","WordPress.com","exame",""		
2019-06-24,"21:08:00","Trump tem razão, exército americano não tem o que fazer no Golfo, diz Irã https://t.co/L0386b7hul","WordPress.com","exame",""		
2019-06-24,"20:58:13","Bolsonaro vetará lista tríplice em projeto sobre agências reguladoras https://t.co/4zUOehu8zu","WordPress.com","exame",""		
2019-06-24,"20:49:46","Após cirurgia, filho de Luciano Huck e Angélica recebe alta da UTI https://t.co/2mV2hh8S8x","WordPress.com","exame",""		
2019-06-24,"20:49:16","Defesa de Lula alega idade e prioridade ao pedir manutenção de julgamento https://t.co/wh3rH1PWDf","WordPress.com","exame",""		
2019-06-24,"20:47:41","Após euforia da última semana, Bolsa e dólar fecham quase estáveis https://t.co/JE4cq2sWEw","WordPress.com","exame",""		
2019-06-24,"20:42:28","Vídeo mostra evolução técnica em animações da Pixar desde 1995 https://t.co/yOIdbCc9ID","WordPress.com","exame",""		
2019-06-24,"20:19:57","Justiça manda leiloar Lamborghini de Eike Batista e lancha de Cabral https://t.co/xnJTCkbQB5","WordPress.com","exame",""		
2019-06-24,"20:14:00","Cabral é punido com isolamento por ter equipado cela com cinema https://t.co/iE3dyJVHG3","WordPress.com","exame",""		
2019-06-24,"20:06:39","Rappi lança cartão para atender também o público desbancarizado https://t.co/O7EEcSv1o7","WordPress.com","exame",""		
2019-06-24,"20:01:04","Caixa busca reduzir 98% de gastos com publicidade, diz presidente do banco https://t.co/tESiV6QXdQ","WordPress.com","exame",""		
2019-06-24,"19:53:44","MPF e Cade temem queda de concorrência e cobram Anac sobre Avianca https://t.co/cy8mdDG9ba","WordPress.com","exame",""		
2019-06-24,"19:47:23","Governo vai reduzir previsão de alta do PIB neste ano, diz subsecretário https://t.co/jZYKygBdOx","WordPress.com","exame",""		
2019-06-24,"19:33:22","Joice diz que Bolsonaro pode vetar projeto das agências reguladoras https://t.co/ciqLYdCDxj","WordPress.com","exame","CopaAmerica"		
2019-06-24,"19:33:21","Os anos 80 estão de volta: Nike lança coleção inspirada em Stranger Things https://t.co/vadk2ecH7h","WordPress.com","exame",""		
2019-06-24,"19:26:47","Ministra da Agricultura pede fim do protecionismo em países desenvolvidos https://t.co/5c5zq0cSDB","WordPress.com","exame",""		
2019-06-24,"19:12:29","Stranger Things e La Casa de Papel: veja as estreias da Netflix em julho https://t.co/aztieVgE0t","WordPress.com","exame",""		
2019-06-24,"19:11:44","Caixa quer pagar pelo menos R$ 20 bilhões ao Tesouro este ano https://t.co/a52IADh9jx","WordPress.com","exame",""		
2019-06-24,"18:51:07","Deputados devem derrubar o decreto de armas, diz Maia https://t.co/OyitgExa8i","WordPress.com","exame",""		
2019-06-24,"18:41:39","Enfrentando contratempos, Tesla luta para retomar crescimento https://t.co/E5eA9mH6Gu","WordPress.com","exame",""		
2019-06-24,"18:37:11","Sobreviventes são encontrados dois dias após desabamento no Camboja https://t.co/wKlyDKng9E","WordPress.com","exame",""		
2019-06-24,"18:37:02","Afinal, o que estava na carta de Kim Jong-un a Trump? Um feliz aniversário		
		
https://t.co/ahZDKc5MNz","Twitter Web Client","exame",""		
2019-06-24,"18:14:28","Arrecadação em maio soma R$ 113,2 bi, alta real de 1,92% ante maio de 2018 https://t.co/Tw5cFJL6TU","WordPress.com","exame",""		
2019-06-24,"18:07:41","Fitch: Reforma da Previdência avança, mas riscos ao crescimento persistem https://t.co/LnQCfEYtbw","WordPress.com","exame",""		
2019-06-24,"18:00:55","A maioria dos profissionais quer trabalhar em empresas com este benefício https://t.co/f3P0JyORFz","WordPress.com","exame",""		
2019-06-24,"18:00:45","Para CEO de mineradora dos EUA, otimismo sobre Vale é “ingênuo” https://t.co/N5ijBYBoO6","WordPress.com","exame",""		
2019-06-24,"18:00:31","Rodrigo Maia lança podcast e se diz contra movimento por sua reeleição https://t.co/69o5233Fhx","WordPress.com","exame",""		
2019-06-24,"17:59:55","Google vai investir 1 bilhão de euros em construção de centros de dados https://t.co/bF8FcDHXzz","WordPress.com","exame",""		
2019-06-24,"17:58:59","Governo quer parecer da Previdência sobre BPC e policias federais https://t.co/VDdHeSgABk","WordPress.com","exame",""		
2019-06-24,"17:57:22","Resultado no 1º trimestre foi surpresa positiva, diz presidente da Caixa https://t.co/WBltp3S6rX","WordPress.com","exame",""		
2019-06-24,"17:52:36","“Por que tanto medo da verdade?”, diz Lula após STF adiar julgamento https://t.co/TtUUIGnXgU","WordPress.com","exame",""		
2019-06-24,"17:50:07","Avião militar da Rússia aterrissa na Venezuela, diz agência https://t.co/xGbdTxBgix","WordPress.com","exame",""		
2019-06-24,"17:50:05","Bomba da Segunda Guerra explode e deixa cratera gigante na Alemanha https://t.co/019yTkIl05","WordPress.com","exame",""		
2019-06-24,"17:42:27","Veneza precisa ser colocada em lista de risco da Unesco, pedem ativistas https://t.co/V6udCzyfES","WordPress.com","exame",""		
2019-06-24,"17:35:35","Ministro diz que estuda estender isenção de IR de debêntures a PJ https://t.co/GyYf2fpaQo","WordPress.com","exame",""		
2019-06-24,"17:31:50","Promotoria critica volta de demarcação de terras indígenas à Agricultura https://t.co/sqw2fKxym3","WordPress.com","exame",""		
2019-06-24,"17:26:05","Colisão entre aviões militares deixa um morto na Alemanha https://t.co/wlfyu5jg51","WordPress.com","exame",""		
2019-06-24,"16:58:25","STF adiará julgamento sobre suspeição de Moro em processo de Lula https://t.co/N4TIIzQ8U7","WordPress.com","exame",""		
2019-06-24,"16:35:06","Ao contrário de Bolsonaro, Bezerra elogia projeto de agências reguladoras https://t.co/WsT4OTMZ3C","WordPress.com","exame",""		
2019-06-24,"16:30:44","Banco Lloyds congela 8 mil contas em campanha contra lavagem de dinheiro https://t.co/xEyyUPNITC","WordPress.com","exame",""		
2019-06-24,"16:26:51","Juiz do Paraná diz que “brasileiro tem muito direito e pouca obrigação” https://t.co/27cSvQMUFW","WordPress.com","exame",""		
2019-06-24,"16:19:00","Trump vai impor sanções ao líder supremo do Irã https://t.co/QeiJLbeYBc","WordPress.com","exame",""		
2019-06-24,"16:18:11","Holiday quer internação psiquiátrica a grávidas com “propensão” a abortar https://t.co/pMlGUUAwvb","WordPress.com","exame",""		
2019-06-24,"15:56:48","Irã e Venezuela podem complicar acordo sobre petróleo, diz Cazaquistão https://t.co/RhRy7TmVFD","WordPress.com","exame",""		
2019-06-24,"15:43:44","Investimento Direto no País soma US$ 7,070 bilhões em maio, diz BC https://t.co/M7az0htBuA","WordPress.com","exame",""		
2019-06-24,"15:36:33","Governo vê aprovação de reforma em julho com mais de 330 votos https://t.co/m1l1ZUfvLC","WordPress.com","exame",""		
2019-06-24,"15:33:18","Acionistas da Nissan devem apoiar CEO em meio a desgaste com Renault https://t.co/FhOSF80AqX","WordPress.com","exame",""		
2019-06-24,"15:21:36","Relatório deve ser votado até dia 27 na Comissão, diz Rodrigo Maia https://t.co/vqhD4B1XqR","WordPress.com","exame",""		
2019-06-24,"15:07:07","Claro que proposta de reforma tributária não é anti-Guedes, diz Rossi		
		
https://t.co/pOvOFaTp2s","Twitter Web Client","exame",""		
2019-06-24,"14:48:30","Ministério da Agricultura divulga registro de 42 agrotóxicos https://t.co/A8pyky4jvp","WordPress.com","exame",""		
2019-06-24,"14:45:29","Bernie Sanders quer cancelar US$ 1,6 trilhão em dívidas estudantis		
		
https://t.co/F3XtODlEtP","Twitter Web Client","exame",""		
2019-06-24,"14:45:05","A difícil paz entre Israel e Palestina, 30 anos depois do primeiro passo https://t.co/cz8pAwG6g6","WordPress.com","exame",""		
2019-06-24,"14:39:23","Assassino em série é condenado no Chipre a sete penas de prisão perpétua https://t.co/jsYRZWtaUD","WordPress.com","exame",""		
2019-06-24,"14:25:20","Trump critica Fed por manter a taxa de juros: “Eles estragaram tudo!” https://t.co/AJFEBJojgc","WordPress.com","exame",""		
2019-06-24,"14:11:22","Este batom da MAC já levantou US$ 500 milhões na luta contra HIV/Aids https://t.co/cKYjkl8HKY","WordPress.com","exame",""		
2019-06-24,"14:08:24","FedEx devolve pacote de entrega da Huawei e reacende ira chinesa https://t.co/Flvmw3opcz","WordPress.com","exame",""		
2019-06-24,"14:04:57","31 delatores dão “calote” de R$ 120 milhões à Justiça, diz MPF https://t.co/h6WBKyc4Fp","WordPress.com","exame",""		
2019-06-24,"13:49:47","Bolsonaro de “rainha”: Ninguém quer suprimir papel do presidente, diz Maia https://t.co/42O3sbj2wn","WordPress.com","exame",""		
2019-06-24,"13:35:46","Via Láctea colidiu violentamente com galáxia anã, diz estudo https://t.co/BoepDl2V7q","WordPress.com","exame",""		
2019-06-24,"13:34:37","Representante do Facebook pede regulamentação sobre empresas digitais https://t.co/cANhljh1LN","WordPress.com","exame",""		
2019-06-24,"13:23:28","Pesquisa da FGV aponta que consumidores esperam inflação de 5,4% https://t.co/LhppPpUQWM","WordPress.com","exame",""		
2019-06-24,"13:13:07","Ponte do Jaguaré permanece fechada nesta segunda-feira https://t.co/FjTOuAZn40","WordPress.com","exame",""		
2019-06-24,"13:02:35","Mais de 18 mil venezuelanos pediram asilo na UE desde o início do ano https://t.co/pvTJJQbWC2","WordPress.com","exame",""		
2019-06-24,"12:58:23","A crise conjugal de Boris Johnson afetará a sucessão no Reino Unido? https://t.co/YCAFg9lpRq","WordPress.com","exame",""		
2019-06-24,"12:56:10","PSL e PSOL são os partidos mais coesos em votações na Câmara dos Deputados		
		
https://t.co/4mUDMWupc5","Twitter Web Client","exame",""		
2019-06-24,"12:52:26","Exportações de petróleo do Irã caem mais em junho com sanções de Trump https://t.co/CFgzlOa49g","WordPress.com","exame",""		
2019-06-24,"12:47:05","CPTM estuda retomar trens para Santos — dessa vez só para turistas https://t.co/EzTnywHGt8","WordPress.com","exame",""		
2019-06-24,"12:41:20","Bitcoin testa máxima em 15 meses após salto de 10% no fim de semana https://t.co/lCw2mlG3tM","WordPress.com","exame",""		
2019-06-24,"12:30:37","Focus reduz pela 17ª vez projeção para PIB de 2019 e vê Selic mais baixa https://t.co/wFANltIbzo","WordPress.com","exame",""		
2019-06-24,"12:30:10","Irã diz que não sofreu danos após suposto ataque cibernético dos EUA https://t.co/VrvkfpZMn6","WordPress.com","exame",""		
2019-06-24,"12:28:48","Dólar recua com expectativa sobre indicadores brasileiros e cúpula do G20 https://t.co/JlMgx9BmQk","WordPress.com","exame",""		
2019-06-24,"12:26:37","Caixa Econômica Federal tem alta de 23% no lucro líquido do 1º tri https://t.co/QMbD8uVLww","WordPress.com","exame",""		
2019-06-24,"12:12:31","Em áudio, Moro pede desculpas ao MBL por tê-los chamado de “tontos” https://t.co/P0qnNMYKRX","WordPress.com","exame",""		
2019-06-24,"12:02:42","O Brasil balança, mas não cai, diz fundador da Cyrela https://t.co/m8ZMfZ7wNH","WordPress.com","exame",""		
2019-06-24,"11:55:42","Anac anuncia tomada de subsídios sobre slots da Avianca https://t.co/GpeF3SF0OQ","WordPress.com","exame",""		
2019-06-24,"11:32:12","Prefeitura de SP define hoje se mantém bloqueio na Ponte do Jaguaré https://t.co/lR2fjMnAiz","WordPress.com","exame","ORGULHOLGBT"		
2019-06-24,"11:23:55","Caixa se desfaz de ações de Petrobras e reservas terminam hoje https://t.co/kNdqZsEmZL","WordPress.com","exame",""		
2019-06-24,"11:07:16","Bolsonaro rejeita estados na Previdência; Moro no STF e tudo para ler hoje https://t.co/jfq643x2pS","WordPress.com","exame",""		
2019-06-24,"10:53:05","Celso de Mello deve decidir destino de Lula e Moro https://t.co/xePCqkz8Nk","WordPress.com","exame",""		
2019-06-24,"10:46:26","Negociadores da China e EUA discutem comércio antes de encontro para G20 https://t.co/2tewhGM4Sq","WordPress.com","exame",""		
2019-06-24,"10:23:19","Curtas – uma seleção do mais importante no Brasil e no mundo https://t.co/awWjckbeor","WordPress.com","exame",""		
2019-06-24,"9:53:26","Temperaturas podem bater 42ºC e Europa entra em alerta https://t.co/bezavytt5e","WordPress.com","exame",""		
2019-06-24,"9:43:27","Trump diz não querer guerra — e foco vai do Irã à China https://t.co/KGU4vfieGj","WordPress.com","exame",""		
2019-06-24,"9:27:31","No Twitter, Bolsonaro volta a dizer que juros são altos para agricultores https://t.co/XlnQnA32Jl","WordPress.com","exame",""		
2019-06-24,"9:15:25","Ninguém quer as Olimpíadas: COI escolhe sede dos jogos de inverno https://t.co/uRk2YyovDf","WordPress.com","exame",""		
2019-06-24,"9:09:57","Na Câmara e no STF, Moro será (de novo) o protagonista da semana https://t.co/4kaXpGcOE4","WordPress.com","exame","EstadaoMonitora"		
2019-06-24,"9:00:44","Darwin estava certo: as lideranças precisam se adaptar para evoluir https://t.co/AnQ97hLdKw","WordPress.com","exame",""		
2019-06-24,"9:00:38","Quais são as startups de delivery preferidas dos brasileiros? https://t.co/2TNnKEY6cX","WordPress.com","exame",""		
2019-06-24,"9:00:37","Por dentro da nova sede da Grow, que triplicou para unir Grin e Yellow https://t.co/BuUr65OVIZ","WordPress.com","exame",""		
2019-06-24,"8:55:34","XP testa aplicativo que ensina termos a investidores iniciantes https://t.co/FssY5WOfiD","WordPress.com","exame",""		
2019-06-24,"8:55:32","Santander, Grupo XP e mais 23 empresas recrutam para estágio e trainee https://t.co/3hdGJgZbgH","WordPress.com","exame",""		
2019-06-24,"8:01:44","Os carros automáticos que mais e menos se depreciam https://t.co/achQQC9srO","WordPress.com","exame",""		
2019-06-24,"1:45:31","Brasil é eliminado da Copa feminina ao perder nas oitavas para a França https://t.co/n11YPcODaQ","WordPress.com","exame",""		
2019-06-23,"20:53:02","Para 66% dos profissionais LGBT+, se assumir pode prejudicar a carreira https://t.co/msD7EWx6lA","WordPress.com","exame",""		
2019-06-23,"20:49:18","Chefe da ONU diz que é essencial evitar escalada de tensões no Irã https://t.co/oAXEqRWrFr","WordPress.com","exame",""		
2019-06-23,"19:41:35","Pompeo diz que EUA estão preparados para negociar com o Irã https://t.co/smNmtzNY45","WordPress.com","exame",""		
2019-06-23,"19:17:13","Plano de paz americano quer levantar US$ 50 bilhões para palestinos https://t.co/QyywUStUG1","WordPress.com","exame",""		
2019-06-23,"19:07:58","Esta empresa cobra – e caro – pelo uso das salas de reuniões https://t.co/R7pSjSDazl","WordPress.com","exame",""		
2019-06-23,"19:07:31","Imigrantes descrevem centros de detenção superlotados na fronteira https://t.co/Ctgi1A6fuv","WordPress.com","exame",""		
2019-06-23,"19:02:46","Deputada Flordelis diz ter esperança de que filhos sejam inocentes https://t.co/2Mo7utaLTh","WordPress.com","exame",""		
2019-06-23,"18:53:42","Hamilton dispara na liderança com vitória no GP da França https://t.co/bAbEpBpFWn","WordPress.com","exame",""		
2019-06-23,"18:42:29","“Meninos da caverna” recordam um ano de sua aventura na Tailândia https://t.co/ZyfuVOI0cr","WordPress.com","exame",""		
2019-06-23,"18:20:04","Discussão doméstica de Johnson gera debate sobre efeito em campanha https://t.co/SH1KzBUbjd","WordPress.com","exame",""		
2019-06-23,"18:15:05","Multidão se reúne em Praga para pedir renúncia do premiê https://t.co/9rljJ54GbG","WordPress.com","exame",""		
2019-06-23,"18:10:40","Procuradores querem evitar saída de inquérito Palocci com Lava Jato https://t.co/n0QbWkkCP8","WordPress.com","exame",""		
2019-06-23,"18:05:23","Veículo em Marte detecta gás que sugere possibilidade de vida https://t.co/d7nWNmLqhH","WordPress.com","exame",""		
2019-06-23,"18:02:39","Oposição a Erdogan, Ekrem Imamoglu é eleito prefeito de Istambul https://t.co/aIiOQwcRJe","WordPress.com","exame",""		
2019-06-23,"17:32:55","Chinês é eleito diretor geral da FAO e substitui brasileiro https://t.co/DyLDzlYAjZ","WordPress.com","exame",""		
2019-06-23,"17:27:26","Parada do Orgulho LGBT começa com tom político e reúne famílias em SP https://t.co/1ZyiWgV2kR","WordPress.com","exame",""		
2019-06-23,"17:03:19","Veja o resultado do concurso 2.162 da Mega-Sena https://t.co/yMHSoXErSo","WordPress.com","exame",""		
2019-06-23,"16:30:03","Trump diz que processo de impeachment facilitará sua reeleição https://t.co/BkGn2ZyXrS","WordPress.com","exame",""		
2019-06-23,"16:21:02","CPI vê falhas do BNDES em operações em Cuba e na Venezuela https://t.co/pwG7RsLTwG","WordPress.com","exame",""		
2019-06-23,"16:14:54","Justiça do Sudão determina retomada de serviços de internet https://t.co/hgUl9NZgcS","WordPress.com","exame",""		
2019-06-23,"16:07:17","Novas mensagens sugerem articulação para proteger Moro https://t.co/v9SGQWoxVX","WordPress.com","exame",""		
2019-06-23,"15:59:33","“Assistimos a um parlamentarismo branco na reforma”, diz economista https://t.co/mevikJHFUj","WordPress.com","exame",""		
2019-06-23,"15:37:57","Setor público usa tecnologia para reduzir papelada e melhorar serviço https://t.co/K3CwK3GM1u","WordPress.com","exame",""		
2019-06-23,"15:23:27","“Estamos vendo nascer o Tea Party democrata”, diz sociólogo americano https://t.co/umn9sYZlVX","WordPress.com","exame",""		
2019-06-23,"15:22:00","Países do sudeste asiático se unem contra a poluição dos oceanos https://t.co/CsnRlkhJ6y","WordPress.com","exame",""		
2019-06-23,"15:09:51","Fachin nega habeas a ex-gerente da Petrobras condenado na Lava Jato https://t.co/u91oYdiRDn","WordPress.com","exame",""		
2019-06-23,"14:44:00","Grupo que investiga caso Queiroz é “filho” da Lava Jato no MP do Rio https://t.co/o3rWDX9roQ","WordPress.com","exame",""		
2019-06-23,"14:36:38","Depressão e estresse elevam risco de doença cardíaca em até 30% https://t.co/qfk2eFlUL4","WordPress.com","exame",""		
2019-06-23,"14:25:05","Trump diz que não ameaçou destituir chairman do Fed https://t.co/bkwSJU7V9G","WordPress.com","exame",""		
2019-06-23,"14:24:01","Bolsonarista raiz assume a defesa de Flávio Bolsonaro https://t.co/04Yvg3FeTy","WordPress.com","exame",""		
2019-06-23,"14:11:15","EUA lançaram ataques cibernéticos contra o Irã https://t.co/kUDBFUKcIb","WordPress.com","exame",""		
2019-06-23,"14:04:37","Candidatura de bilionário cresce e vira surpresa das eleições no Uruguai https://t.co/bA0oX8Qphl","WordPress.com","exame",""		
2019-06-23,"13:49:25","Falta de perdão é associada a risco de enfarte, segundo estudo https://t.co/j8rWf0Qnhu","WordPress.com","exame",""		
2019-06-23,"13:40:52","Huck confirma que filho de 11 anos sofreu acidente e foi operado https://t.co/dsB9wsEPBS","WordPress.com","exame",""		
2019-06-23,"13:29:01","Vale testa alternativa sem uso de água para mineração https://t.co/PQN315kPAZ","WordPress.com","exame",""		
2019-06-23,"13:26:51","Carrefour vende controle de suas atividades na China https://t.co/vA1kNPTDZA","WordPress.com","exame",""		
2019-06-23,"13:26:25","Kim Jong Un diz ter recebido uma “carta excelente” de Trump https://t.co/gOrrsVjtVS","WordPress.com","exame",""		
2019-06-23,"13:00:59","Lesma eletrocutada causa caos ferroviário no Japão https://t.co/1Lf3Wrs1sW","WordPress.com","exame",""		
2019-06-23,"12:57:51","Brasileiro é o mais jovem do mundo a passar no mestrado em Harvard https://t.co/FjXK0RJdba","WordPress.com","exame",""		
2019-06-23,"12:51:54","Reforma da Previdência virou “palavra mágica”, diz Bolsonaro https://t.co/8IzgAfTVYD","WordPress.com","exame",""		
2019-06-23,"12:46:39","Parada LGBT relembra 50 anos de protestos em Nova York https://t.co/a8CMuNwwWu","WordPress.com","exame",""		
2019-06-23,"12:31:05","Filho mais velho de Luciano Huck e Angélica é internado no Rio https://t.co/7UyQtiejta","WordPress.com","exame",""		
2019-06-23,"12:27:11","Com crise, renda do trabalhador chegou a cair até 16% em cinco anos https://t.co/QAxUgBKRRD","WordPress.com","exame",""		
2019-06-23,"12:22:42","Brasil desafia favoritismo da anfitriã França nas oitavas da Copa do Mundo https://t.co/Ubjkshzlpz","WordPress.com","exame",""		
2019-06-23,"11:59:33","Review: One Vision se destaca por fotos noturnas e “Android puro” https://t.co/9E7xsZyQLI","WordPress.com","exame",""		
2019-06-23,"11:55:52","YouTube Kids ainda tenta cair no gosto das crianças (e os pais agradecem) https://t.co/L0gN19eYne","WordPress.com","exame",""		
2019-06-23,"11:35:06","Com shake arco-íris e atrações gringas, BK vem com tudo na Parada LGBT https://t.co/ynUKIG6I3t","WordPress.com","exame",""		
2019-06-23,"11:01:01","Renováveis vão responder por 50% da eletricidade global até 2050 https://t.co/eh3E9yUdL3","WordPress.com","exame",""		
2019-06-23,"11:00:35","Negócios abertos por oportunidade voltam a crescer no país https://t.co/rw8b4yhp8H","WordPress.com","exame",""		
2019-06-23,"10:15:19","É a vez do ouro? Metal bate US$ 1.400 com expectativa de corte de juros https://t.co/S0KqFq9nQP","WordPress.com","exame",""		
2019-06-23,"10:01:07","O drink perfeito para a festa do Orgulho Gay: vodca e rosé https://t.co/STNLDzsqKK","WordPress.com","exame",""		
2019-06-23,"10:00:51","Mulheres se unem para conquistar independência financeira https://t.co/ivVdnsRUOH","WordPress.com","exame",""		
2019-06-23,"9:01:09","Google vai distribuir R$ 2 milhões em bolsas de estudo. Inscrições abertas https://t.co/CrHCFlh3dp","WordPress.com","exame",""		
2019-06-22,"20:45:06","Países latinos “exportam” refugiados, mesmo com boa condição financeira https://t.co/UIML3SJiif","WordPress.com","exame",""		
2019-06-22,"20:07:30","Boris Johnson evita perguntas sobre visita da polícia à sua casa https://t.co/VkbQ9QxXYr","WordPress.com","exame",""		
2019-06-22,"18:47:33","Plano de paz dos EUA quer levantar US$ 50 bi para palestinos https://t.co/YAkXC27xUE","WordPress.com","exame",""		
2019-06-22,"17:46:02","Querem me deixar como Rainha da Inglaterra, diz Bolsonaro sobre Congresso https://t.co/94HNmiPACF","WordPress.com","exame",""		
2019-06-22,"17:27:33","Argentina inicia campanha presidencial em plena recessão https://t.co/QujVNlac5k","WordPress.com","exame",""		
2019-06-22,"17:15:58","Trump pede que Irã desista de programa nuclear: ‘serei seu melhor amigo’ https://t.co/cT2v9Cpuqq","WordPress.com","exame",""		
2019-06-22,"17:09:28","Alemanha deve combater o extremismo de direita, diz Merkel https://t.co/D2WUnGYoLS","WordPress.com","exame",""		
2019-06-22,"15:45:17","Manifestantes voltam às ruas de Hong Kong, que terá protestos antes do G20 https://t.co/0cDxauh1h9","WordPress.com","exame",""		
2019-06-22,"15:37:57","Estilista revolta indígenas ao usar seus desenhos em coleção de luxo https://t.co/IFP8vT00C1","WordPress.com","exame",""		
2019-06-22,"15:13:45","Após críticas, relator deve sugerir migração gradual do FAT à Previdência https://t.co/PMxD0idI3j","WordPress.com","exame",""		
2019-06-22,"14:08:06","Semáforos para pedestres da Avenida Paulista ganham casais homoafetivos https://t.co/2NQco8aABe","WordPress.com","exame",""		
2019-06-22,"14:02:35","Brasil termina Cannes Lions com ouro em filme e 85 leões https://t.co/E1dRl9pzlp","WordPress.com","exame",""		
