date,"hour","text","source","username","hashtags"		
2019-06-22,"1:08:10","RT @placar: Copa América: Chile garante classificação após vitória sobre Equador		
https://t.co/hRfgQYbvu3 https://t.co/lHHC7DYW9m","Twitter for iPhone","VEJA",""		
2019-06-22,"0:20:17","E Trump piscou para o Irã https://t.co/BEHS7Uahjy","WordPress.com","VEJA",""		
2019-06-22,"0:01:47","Michelle Bachelet deixará delegados da ONU na Venezuela, diz Guaidó https://t.co/Rslh0d0ZYV","WordPress.com","VEJA",""		
2019-06-21,"23:49:28","Marquinhos: ‘Neymar e o presidente do PSG sabem o que fazem’ https://t.co/FUItCVz1Gv","WordPress.com","VEJA",""		
2019-06-21,"23:12:36","‘Fake news’: Tite nega espionagem com drone em treino do Peru https://t.co/X0lArrMzrw","WordPress.com","VEJA",""		
2019-06-21,"22:55:14","Tite indica mudanças na seleção para ‘decisão’ contra o Peru https://t.co/YnXnrsZzGB","WordPress.com","VEJA",""		
2019-06-21,"22:45:04","RT @placar: https://t.co/T3hrOI5rzd","Twitter for iPhone","VEJA",""		
2019-06-21,"21:46:26","Morre o maestro Silvio Baccarelli, criador da Orquestra Juvenil Heliópolis https://t.co/aek9KY4yeq","WordPress.com","VEJA",""		
2019-06-21,"21:44:10","Ex-terceiro melhor do mundo, Fernando Torres se aposenta https://t.co/lA18kBeifw","WordPress.com","VEJA",""		
2019-06-21,"21:32:40","MPF denuncia Marconi Perillo por propina de R$ 17,8 mi da Odebrecht https://t.co/Nufb5ZgCgn","WordPress.com","VEJA",""		
2019-06-21,"21:15:18","Rolling Stones retomam turnê após recuperação de Mick Jagger https://t.co/7vflSPB9Wm","WordPress.com","VEJA",""		
2019-06-21,"21:00:49","OIT adota 1ª convenção contra violência e assédio no trabalho https://t.co/ESO2lzIepe","WordPress.com","VEJA",""		
2019-06-21,"20:58:59","Copa América: enfim, uma chance para o ‘novo Messi’ https://t.co/xdKYjEfHqj","WordPress.com","VEJA",""		
2019-06-21,"20:52:25","EUA proíbem venda de peças de supercomputadores para empresas chinesas https://t.co/BEsdPDePIe","WordPress.com","VEJA",""		
2019-06-21,"20:36:41","Governo retomará modelo antigo na articulação política, diz Bolsonaro https://t.co/X4Bu8uF4Nk","WordPress.com","VEJA",""		
2019-06-21,"20:31:29","China, Geórgia e França disputam comando da FAO no domingo https://t.co/cPgVSmmExN","WordPress.com","VEJA",""		
2019-06-21,"20:16:07","Estréia em Nova York ópera sobre revolta LGBT em 1969 https://t.co/XcdDM7nlGu","WordPress.com","VEJA",""		
2019-06-21,"19:43:45","Ursa polar perdida é levada a zoológico da Sibéria para ser tratada https://t.co/wGA6gC2wtT","WordPress.com","VEJA",""		
2019-06-21,"18:59:11","BNDES pode devolver R$100 bi ao governo em 2019, diz conselheiro https://t.co/FuRisuJkYR","WordPress.com","VEJA",""		
2019-06-21,"18:39:21","Trump aborta ataque dos EUA ao Irã para evitar 150 mortes https://t.co/1OfdPpAH9x","WordPress.com","VEJA",""